### ISSUE TITLE
Echo spot: ok; Echo 2: not ok

### ISSUE THREAD

**Issue by Nickduino** [Nickduino/Pi-Somfy#26]
I have two Amazon devices : one echo spot (controlled from an Android device) and an Amazon echo 2 (paired with an iPhone and an iPad).  The devices are configured on two different Amazon accounts but are connected through the same WiFi network.

The echo spot does find the fauxmo devices and controls them alright, its bigger brother doesn't

**Comment by Nickduino** [comment]
Traffic between the RPi (192.168.0.21) and the Echo Spot (0.29) : 

`pi@raspberrypi:~/Pi-Somfy $ sudo tshark -f "host 192.168.0.21 && host 192.168.0.29"
Running as user "root" and group "root". This could be dangerous.
tshark: Lua: Error during loading:
 /usr/share/wireshark/init.lua:32: dofile has been disabled due to running Wireshark as superuser. See https://wiki.wireshark.org/CaptureSetup/CapturePrivileges for help in running Wireshark as an unprivileged user.
Capturing on 'eth0'
    1 0.000000000 192.168.0.21 → 192.168.0.29 UDP 429 35512 → 50000 Len=387
    2 0.004870974 192.168.0.29 → 192.168.0.21 TCP 74 37826 → 52893 [SYN] Seq=0 Win=65535 Len=0 MSS=1460 SACK_PERM=1 TSval=33595557 TSecr=0 WS=64
    3 0.005173972 192.168.0.21 → 192.168.0.29 TCP 74 52893 → 37826 [SYN, ACK] Seq=0 Ack=1 Win=28960 Len=0 MSS=1460 SACK_PERM=1 TSval=182102211 TSecr=33595557 WS=64
    4 0.006818964 192.168.0.29 → 192.168.0.21 TCP 66 37826 → 52893 [ACK] Seq=1 Ack=1 Win=87616 Len=0 TSval=33595558 TSecr=182102211
    5 0.007520960 192.168.0.29 → 192.168.0.21 HTTP 270 GET /setup.xml HTTP/1.1
    6 0.007660959 192.168.0.21 → 192.168.0.29 TCP 66 52893 → 37826 [ACK] Seq=1 Ack=205 Win=30080 Len=0 TSval=182102213 TSecr=33595558
    7 0.504607322 192.168.0.21 → 192.168.0.29 UDP 429 41688 → 50000 Len=387
    8 1.009494642 192.168.0.21 → 192.168.0.29 UDP 429 43370 → 50000 Len=387
    9 1.515265958 192.168.0.21 → 192.168.0.29 UDP 429 35984 → 50000 Len=387
   10 2.043225155 192.168.0.21 → 192.168.0.29 UDP 429 54592 → 50000 Len=387
   11 2.548390474 192.168.0.21 → 192.168.0.29 UDP 429 41399 → 50000 Len=387
   12 2.845623897 192.168.0.29 → 192.168.0.21 TCP 74 34571 → 52898 [SYN] Seq=0 Win=65535 Len=0 MSS=1460 SACK_PERM=1 TSval=33595841 TSecr=0 WS=64
   13 2.845850895 192.168.0.21 → 192.168.0.29 TCP 74 52898 → 34571 [SYN, ACK] Seq=0 Ack=1 Win=28960 Len=0 MSS=1460 SACK_PERM=1 TSval=182105051 TSecr=33595841 WS=64
   14 2.856802837 192.168.0.29 → 192.168.0.21 TCP 66 34571 → 52898 [ACK] Seq=1 Ack=1 Win=87616 Len=0 TSval=33595842 TSecr=182105051
   15 2.857237835 192.168.0.29 → 192.168.0.21 HTTP/XML 687 POST /upnp/control/basicevent1 HTTP/1.1
   16 2.857363834 192.168.0.21 → 192.168.0.29 TCP 66 52898 → 34571 [ACK] Seq=1 Ack=622 Win=30208 Len=0 TSval=182105063 TSecr=33595842
   17 3.054834786 192.168.0.21 → 192.168.0.29 UDP 429 44555 → 50000 Len=387
   18 3.559282109 192.168.0.21 → 192.168.0.29 UDP 429 58745 → 50000 Len=387
   19 3.587729958 192.168.0.21 → 192.168.0.29 HTTP/XML 1437 HTTP/1.1 200 OK
   20 3.590469943 192.168.0.29 → 192.168.0.21 TCP 66 37826 → 52893 [ACK] Seq=205 Ack=1372 Win=90496 Len=0 TSval=33595916 TSecr=182105793
   21 3.591047940 192.168.0.29 → 192.168.0.21 TCP 66 37826 → 52893 [FIN, ACK] Seq=205 Ack=1372 Win=90496 Len=0 TSval=33595916 TSecr=182105793
   22 3.602583879 192.168.0.21 → 192.168.0.29 TCP 66 52893 → 37826 [FIN, ACK] Seq=1372 Ack=206 Win=30080 Len=0 TSval=182105808 TSecr=33595916
   23 3.606206860 192.168.0.29 → 192.168.0.21 TCP 66 37826 → 52893 [ACK] Seq=206 Ack=1373 Win=90496 Len=0 TSval=33595917 TSecr=182105808
   24 3.630693730 192.168.0.29 → 192.168.0.21 TCP 74 52607 → 52898 [SYN] Seq=0 Win=65535 Len=0 MSS=1460 SACK_PERM=1 TSval=33595920 TSecr=0 WS=64
   25 3.630925728 192.168.0.21 → 192.168.0.29 TCP 74 52898 → 52607 [SYN, ACK] Seq=0 Ack=1 Win=28960 Len=0 MSS=1460 SACK_PERM=1 TSval=182105836 TSecr=33595920 WS=64
   26 3.632339721 192.168.0.29 → 192.168.0.21 TCP 66 52607 → 52898 [ACK] Seq=1 Ack=1 Win=87616 Len=0 TSval=33595920 TSecr=182105836
   27 3.632793718 192.168.0.29 → 192.168.0.21 HTTP 270 GET /setup.xml HTTP/1.1
   28 3.632928718 192.168.0.21 → 192.168.0.29 TCP 66 52898 → 52607 [ACK] Seq=1 Ack=205 Win=30080 Len=0 TSval=182105838 TSecr=33595920
   29 4.116395152 192.168.0.21 → 192.168.0.29 UDP 429 45977 → 50000 Len=387
   30 4.621454471 192.168.0.21 → 192.168.0.29 UDP 429 42716 → 50000 Len=387
   31 5.125927793 192.168.0.21 → 192.168.0.29 UDP 429 34601 → 50000 Len=387
   32 5.630662114 192.168.0.21 → 192.168.0.29 UDP 429 56142 → 50000 Len=387
   33 5.651665002 192.168.0.21 → 192.168.0.29 HTTP/XML 670 HTTP/1.1 200 OK
   34 5.653293994 192.168.0.29 → 192.168.0.21 TCP 66 34571 → 52898 [ACK] Seq=622 Ack=605 Win=88832 Len=0 TSval=33596122 TSecr=182107857
   35 5.653904991 192.168.0.29 → 192.168.0.21 TCP 66 34571 → 52898 [FIN, ACK] Seq=622 Ack=605 Win=88832 Len=0 TSval=33596122 TSecr=182107857
   36 5.678001863 192.168.0.21 → 192.168.0.29 TCP 66 52898 → 34571 [FIN, ACK] Seq=605 Ack=623 Win=30208 Len=0 TSval=182107883 TSecr=33596122
   37 5.679529855 192.168.0.29 → 192.168.0.21 TCP 66 34571 → 52898 [ACK] Seq=623 Ack=606 Win=88832 Len=0 TSval=33596125 TSecr=182107883
   38 5.713502674 192.168.0.21 → 192.168.0.29 HTTP/XML 1426 HTTP/1.1 200 OK
   39 5.723501621 192.168.0.29 → 192.168.0.21 TCP 66 52607 → 52898 [ACK] Seq=205 Ack=1361 Win=90496 Len=0 TSval=33596129 TSecr=182107919
   40 5.724811614 192.168.0.29 → 192.168.0.21 TCP 66 52607 → 52898 [FIN, ACK] Seq=205 Ack=1361 Win=90496 Len=0 TSval=33596129 TSecr=182107919
   41 5.727326601 192.168.0.21 → 192.168.0.29 TCP 66 52898 → 52607 [FIN, ACK] Seq=1361 Ack=206 Win=30080 Len=0 TSval=182107933 TSecr=33596129
   42 5.734212564 192.168.0.29 → 192.168.0.21 TCP 74 38291 → 54337 [SYN] Seq=0 Win=65535 Len=0 MSS=1460 SACK_PERM=1 TSval=33596130 TSecr=0 WS=64
   43 5.734482563 192.168.0.21 → 192.168.0.29 TCP 74 54337 → 38291 [SYN, ACK] Seq=0 Ack=1 Win=28960 Len=0 MSS=1460 SACK_PERM=1 TSval=182107940 TSecr=33596130 WS=64
   44 5.734217564 192.168.0.29 → 192.168.0.21 TCP 74 40114 → 52898 [SYN] Seq=0 Win=65535 Len=0 MSS=1460 SACK_PERM=1 TSval=33596130 TSecr=0 WS=64
   45 5.734756561 192.168.0.21 → 192.168.0.29 TCP 74 52898 → 40114 [SYN, ACK] Seq=0 Ack=1 Win=28960 Len=0 MSS=1460 SACK_PERM=1 TSval=182107940 TSecr=33596130 WS=64
   46 5.739131538 192.168.0.29 → 192.168.0.21 TCP 66 52607 → 52898 [ACK] Seq=206 Ack=1362 Win=90496 Len=0 TSval=33596131 TSecr=182107933
   47 5.740936529 192.168.0.29 → 192.168.0.21 TCP 66 38291 → 54337 [ACK] Seq=1 Ack=1 Win=87616 Len=0 TSval=33596131 TSecr=182107940
   48 5.742209522 192.168.0.29 → 192.168.0.21 TCP 66 40114 → 52898 [ACK] Seq=1 Ack=1 Win=87616 Len=0 TSval=33596131 TSecr=182107940
   49 5.742215522 192.168.0.29 → 192.168.0.21 HTTP 270 GET /setup.xml HTTP/1.1
   50 5.742606520 192.168.0.21 → 192.168.0.29 TCP 66 54337 → 38291 [ACK] Seq=1 Ack=205 Win=30080 Len=0 TSval=182107948 TSecr=33596131
   51 5.742217522 192.168.0.29 → 192.168.0.21 HTTP/XML 687 POST /upnp/control/basicevent1 HTTP/1.1
   52 5.742830519 192.168.0.21 → 192.168.0.29 TCP 66 52898 → 40114 [ACK] Seq=1 Ack=622 Win=30208 Len=0 TSval=182107948 TSecr=33596131
   53 5.770019374 192.168.0.21 → 192.168.0.29 HTTP/XML 670 HTTP/1.1 200 OK
   54 5.771901364 192.168.0.29 → 192.168.0.21 TCP 66 40114 → 52898 [ACK] Seq=622 Ack=605 Win=88832 Len=0 TSval=33596134 TSecr=182107975
   55 5.772721360 192.168.0.29 → 192.168.0.21 TCP 66 40114 → 52898 [FIN, ACK] Seq=622 Ack=605 Win=88832 Len=0 TSval=33596134 TSecr=182107975
   56 5.808741169 192.168.0.21 → 192.168.0.29 HTTP/XML 1421 HTTP/1.1 200 OK
   57 5.816588127 192.168.0.29 → 192.168.0.21 TCP 66 38291 → 54337 [ACK] Seq=205 Ack=1356 Win=90496 Len=0 TSval=33596138 TSecr=182108014
   58 5.816593127 192.168.0.29 → 192.168.0.21 TCP 66 38291 → 54337 [FIN, ACK] Seq=205 Ack=1356 Win=90496 Len=0 TSval=33596138 TSecr=182108014
   59 5.819503112 192.168.0.21 → 192.168.0.29 TCP 66 52898 → 40114 [ACK] Seq=605 Ack=623 Win=30208 Len=0 TSval=182108025 TSecr=33596134
   60 5.823283091 192.168.0.21 → 192.168.0.29 TCP 66 52898 → 40114 [FIN, ACK] Seq=605 Ack=623 Win=30208 Len=0 TSval=182108029 TSecr=33596134
   61 5.827022072 192.168.0.21 → 192.168.0.29 TCP 66 54337 → 38291 [FIN, ACK] Seq=1356 Ack=206 Win=30080 Len=0 TSval=182108032 TSecr=33596138
   62 5.827833067 192.168.0.29 → 192.168.0.21 TCP 74 44851 → 54337 [SYN] Seq=0 Win=65535 Len=0 MSS=1460 SACK_PERM=1 TSval=33596139 TSecr=0 WS=64
   63 5.828054066 192.168.0.21 → 192.168.0.29 TCP 74 54337 → 44851 [SYN, ACK] Seq=0 Ack=1 Win=28960 Len=0 MSS=1460 SACK_PERM=1 TSval=182108034 TSecr=33596139 WS=64
   64 5.827838067 192.168.0.29 → 192.168.0.21 TCP 74 38138 → 54338 [SYN] Seq=0 Win=65535 Len=0 MSS=1460 SACK_PERM=1 TSval=33596139 TSecr=0 WS=64
   65 5.828315065 192.168.0.21 → 192.168.0.29 TCP 74 54338 → 38138 [SYN, ACK] Seq=0 Ack=1 Win=28960 Len=0 MSS=1460 SACK_PERM=1 TSval=182108034 TSecr=33596139 WS=64
   66 5.828897062 192.168.0.29 → 192.168.0.21 TCP 66 40114 → 52898 [ACK] Seq=623 Ack=606 Win=88832 Len=0 TSval=33596139 TSecr=182108029
   67 5.833559037 192.168.0.29 → 192.168.0.21 TCP 66 38291 → 54337 [ACK] Seq=206 Ack=1357 Win=90496 Len=0 TSval=33596140 TSecr=182108032
   68 5.833564037 192.168.0.29 → 192.168.0.21 TCP 66 44851 → 54337 [ACK] Seq=1 Ack=1 Win=87616 Len=0 TSval=33596140 TSecr=182108034
   69 5.834171034 192.168.0.29 → 192.168.0.21 HTTP/XML 687 POST /upnp/control/basicevent1 HTTP/1.1
   70 5.834308033 192.168.0.21 → 192.168.0.29 TCP 66 54337 → 44851 [ACK] Seq=1 Ack=622 Win=30208 Len=0 TSval=182108040 TSecr=33596140
   71 5.834180034 192.168.0.29 → 192.168.0.21 TCP 66 38138 → 54338 [ACK] Seq=1 Ack=1 Win=87616 Len=0 TSval=33596140 TSecr=182108034
   72 5.834182034 192.168.0.29 → 192.168.0.21 HTTP 270 GET /setup.xml HTTP/1.1
   73 5.834729031 192.168.0.21 → 192.168.0.29 TCP 66 54338 → 38138 [ACK] Seq=1 Ack=205 Win=30080 Len=0 TSval=182108040 TSecr=33596140
   74 5.863308879 192.168.0.21 → 192.168.0.29 HTTP/XML 670 HTTP/1.1 200 OK
   75 5.864954870 192.168.0.29 → 192.168.0.21 TCP 66 44851 → 54337 [ACK] Seq=622 Ack=605 Win=88832 Len=0 TSval=33596143 TSecr=182108069
   76 5.865541867 192.168.0.29 → 192.168.0.21 TCP 66 44851 → 54337 [FIN, ACK] Seq=622 Ack=605 Win=88832 Len=0 TSval=33596143 TSecr=182108069
   77 5.901344677 192.168.0.21 → 192.168.0.29 HTTP/XML 1419 HTTP/1.1 200 OK
   78 5.903156668 192.168.0.29 → 192.168.0.21 TCP 66 38138 → 54338 [ACK] Seq=205 Ack=1354 Win=90496 Len=0 TSval=33596147 TSecr=182108107
   79 5.903684665 192.168.0.29 → 192.168.0.21 TCP 66 38138 → 54338 [FIN, ACK] Seq=205 Ack=1354 Win=90496 Len=0 TSval=33596147 TSecr=182108107
   80 5.909501634 192.168.0.21 → 192.168.0.29 TCP 66 54337 → 44851 [ACK] Seq=605 Ack=623 Win=30208 Len=0 TSval=182108115 TSecr=33596143
   81 5.910211630 192.168.0.29 → 192.168.0.21 TCP 74 57030 → 54338 [SYN] Seq=0 Win=65535 Len=0 MSS=1460 SACK_PERM=1 TSval=33596148 TSecr=0 WS=64
   82 5.910463629 192.168.0.21 → 192.168.0.29 TCP 74 54338 → 57030 [SYN, ACK] Seq=0 Ack=1 Win=28960 Len=0 MSS=1460 SACK_PERM=1 TSval=182108116 TSecr=33596148 WS=64
   83 5.912110620 192.168.0.29 → 192.168.0.21 TCP 66 57030 → 54338 [ACK] Seq=1 Ack=1 Win=87616 Len=0 TSval=33596148 TSecr=182108116
   84 5.913082615 192.168.0.29 → 192.168.0.21 HTTP/XML 687 POST /upnp/control/basicevent1 HTTP/1.1
   85 5.913228614 192.168.0.21 → 192.168.0.29 TCP 66 54338 → 57030 [ACK] Seq=1 Ack=622 Win=30208 Len=0 TSval=182108119 TSecr=33596148
   86 5.917458592 192.168.0.21 → 192.168.0.29 TCP 66 54337 → 44851 [FIN, ACK] Seq=605 Ack=623 Win=30208 Len=0 TSval=182108123 TSecr=33596143
   87 5.922156567 192.168.0.29 → 192.168.0.21 TCP 66 44851 → 54337 [ACK] Seq=623 Ack=606 Win=88832 Len=0 TSval=33596149 TSecr=182108123
   88 5.922740564 192.168.0.21 → 192.168.0.29 TCP 66 54338 → 38138 [FIN, ACK] Seq=1354 Ack=206 Win=30080 Len=0 TSval=182108128 TSecr=33596147
   89 5.926541543 192.168.0.29 → 192.168.0.21 TCP 66 38138 → 54338 [ACK] Seq=206 Ack=1355 Win=90496 Len=0 TSval=33596149 TSecr=182108128
   90 5.946018440 192.168.0.21 → 192.168.0.29 HTTP/XML 670 HTTP/1.1 200 OK
   91 5.947556432 192.168.0.29 → 192.168.0.21 TCP 66 57030 → 54338 [ACK] Seq=622 Ack=605 Win=88832 Len=0 TSval=33596152 TSecr=182108151
   92 5.948168429 192.168.0.29 → 192.168.0.21 TCP 66 57030 → 54338 [FIN, ACK] Seq=622 Ack=605 Win=88832 Len=0 TSval=33596152 TSecr=182108151
   93 5.970904308 192.168.0.21 → 192.168.0.29 TCP 66 54338 → 57030 [FIN, ACK] Seq=605 Ack=623 Win=30208 Len=0 TSval=182108176 TSecr=33596152
   94 5.972302300 192.168.0.29 → 192.168.0.21 TCP 66 57030 → 54338 [ACK] Seq=623 Ack=606 Win=88832 Len=0 TSval=33596154 TSecr=182108176
   95 15.995406091 192.168.0.29 → 192.168.0.21 TCP 74 59865 → 54337 [SYN] Seq=0 Win=65535 Len=0 MSS=1460 SACK_PERM=1 TSval=33597156 TSecr=0 WS=64
   96 15.995626090 192.168.0.21 → 192.168.0.29 TCP 74 54337 → 59865 [SYN, ACK] Seq=0 Ack=1 Win=28960 Len=0 MSS=1460 SACK_PERM=1 TSval=182118201 TSecr=33597156 WS=64
   97 15.997609080 192.168.0.29 → 192.168.0.21 TCP 66 59865 → 54337 [ACK] Seq=1 Ack=1 Win=87616 Len=0 TSval=33597157 TSecr=182118201
   98 15.999117072 192.168.0.29 → 192.168.0.21 HTTP/XML 687 POST /upnp/control/basicevent1 HTTP/1.1
   99 15.999302071 192.168.0.21 → 192.168.0.29 TCP 66 54337 → 59865 [ACK] Seq=1 Ack=622 Win=30208 Len=0 TSval=182118205 TSecr=33597157
  100 16.024010940 192.168.0.21 → 192.168.0.29 HTTP/XML 670 HTTP/1.1 200 OK
  101 16.025869930 192.168.0.29 → 192.168.0.21 TCP 66 59865 → 54337 [ACK] Seq=622 Ack=605 Win=88832 Len=0 TSval=33597159 TSecr=182118230
  102 16.026851924 192.168.0.29 → 192.168.0.21 TCP 66 59865 → 54337 [FIN, ACK] Seq=622 Ack=605 Win=88832 Len=0 TSval=33597160 TSecr=182118230
  103 16.049225806 192.168.0.21 → 192.168.0.29 TCP 66 54337 → 59865 [FIN, ACK] Seq=605 Ack=623 Win=30208 Len=0 TSval=182118255 TSecr=33597160
  104 16.055579772 192.168.0.29 → 192.168.0.21 TCP 66 59865 → 54337 [ACK] Seq=623 Ack=606 Win=88832 Len=0 TSval=33597162 TSecr=182118255
^C104 packets captured`


Between the RPi (192.168.0.21) and the Echo v2 (0.37) : 

`pi@raspberrypi:~/Pi-Somfy $ sudo tshark -f "host 192.168.0.21 && host 192.168.0.37"
Running as user "root" and group "root". This could be dangerous.
tshark: Lua: Error during loading:
 /usr/share/wireshark/init.lua:32: dofile has been disabled due to running Wireshark as superuser. See https://wiki.wireshark.org/CaptureSetup/CapturePrivileges for help in running Wireshark as an unprivileged user.
Capturing on 'eth0'
    1 0.000000000 Raspberr_f1:96:bd → Broadcast    ARP 42 Who has 192.168.0.37? Tell 192.168.0.21
    2 1.024495546 Raspberr_f1:96:bd → Broadcast    ARP 42 Who has 192.168.0.37? Tell 192.168.0.21
    3 2.064428010 Raspberr_f1:96:bd → Broadcast    ARP 42 Who has 192.168.0.37? Tell 192.168.0.21
    4 3.553082084 Raspberr_f1:96:bd → Broadcast    ARP 42 Who has 192.168.0.37? Tell 192.168.0.21
    5 4.624442381 Raspberr_f1:96:bd → Broadcast    ARP 42 Who has 192.168.0.37? Tell 192.168.0.21
    6 5.664450844 Raspberr_f1:96:bd → Broadcast    ARP 42 Who has 192.168.0.37? Tell 192.168.0.21`

**Comment by Nickduino** [comment]
Problem solved. You know how? I restarted the Echo :-D
